{
  "$schema": "../schema.json",
  "serviceCode": "ec2Enhancement",
  "displayName": "Amazon EC2",
  "templateId": "template",
  "status": "verified",
  "lastVerifiedAt": "2026-05-16",
  "verifiedEstimateId": "14da95c4aac0054414043dfd2d759d8d0438b51e",
  "required": [
    {
      "field": "instanceType",
      "hint": "AWS instance type (e.g. m5.large, t3.medium). Validated against EC2's instance-finder field.",
      "example": "m5.large"
    },
    {
      "field": "pricingStrategy",
      "hint": "Pricing model. Accepts shorthand strings for simple cases OR a full object for committed pricing.\n\nShorthand (On-Demand/Spot only): \"ondemand\", \"spot\"\n\nFull object (required for any committed/discounted pricing):\n- EC2 Instance Savings Plans: {\"model\":\"instanceSavings\",\"term\":\"1 Year\",\"upfrontPayment\":\"None\"}\n- Compute Savings Plans: {\"model\":\"computeSavings\",\"term\":\"1 Year\",\"upfrontPayment\":\"None\"}\n- Standard Reserved Instances (dedicated tenancy only): {\"model\":\"standard\",\"term\":\"1 Year\",\"upfrontPayment\":\"None\"}\n- Convertible Reserved Instances (dedicated tenancy only): {\"model\":\"convertible\",\"term\":\"1 Year\",\"upfrontPayment\":\"None\"}\n\nValid term values: \"1 Year\", \"3 Year\" (case-insensitive; shorthand \"1yr\"/\"3yr\" also accepted). Term defaults to \"3 Year\" (the cheaper, deeper-commitment Savings Plan) when omitted or unrecognized — pass \"1 Year\" explicitly if you do not want the 3-year commitment.\nValid upfrontPayment values: \"None\", \"Partial\", \"All\" (exact case)\n\nCRITICAL: Do NOT use shorthand \"reserved\" or \"instanceSavings\" for committed pricing — these may silently fall back to On-Demand or produce $0 costs. Always use the full object format for any non-OnDemand, non-Spot pricing. EstimateBuilder normalizes via lib/ec2.js.",
      "enum": [
        "ondemand",
        "reserved",
        "convertible",
        "instanceSavings",
        "computeSavings",
        "spot"
      ],
      "default": "ondemand"
    }
  ],
  "traps": [
    "Use serviceCode 'ec2Enhancement' with templateId 'template'. The legacy (eC2Next, quickEstimate) format saves cleanly but renders Read-only — the calculator cannot rehydrate it. EstimateBuilder forces this transformation automatically; do not bypass it.",
    "Reserved Instances (standard, convertible) are HIDDEN under shared tenancy. For shared tenancy with committed pricing, ALWAYS use the full object format: {\"model\":\"instanceSavings\",\"term\":\"1 Year\",\"upfrontPayment\":\"None\"} or {\"model\":\"computeSavings\",\"term\":\"1 Year\",\"upfrontPayment\":\"None\"}. The shorthand \"reserved\" and \"instanceSavings\" strings are unreliable and may produce On-Demand pricing or $0 costs. Real Standard/Convertible RIs require tenancy:\"dedicated\" or \"host\".",
    "pricingStrategy term accepts '1 Year' or '3 Year' (case-insensitive; shorthand '1yr'/'3yr' also works). Anything else — including an omitted term — defaults to '3 Year'. Pass '1 Year' explicitly when you do not want the 3-year commitment.",
    "pricingStrategy upfrontPayment values: 'None', 'Partial', 'All'. EstimateBuilder accepts shorthand 'No' and converts to 'None'.",
    "The calculator silently demands tenancy, workload, workloadSelection, dataTransferForEC2, detailedMonitoringCheckbox, and ec2AdvancedPricingMetrics — even though the PCT does not mark them validations.required. EstimateBuilder injects all of these via lib/ec2.js#transformConfig.",
    "utilization is HIDDEN inside the pricingStrategy component and does NOT appear in get_service_fields' field list. To set utilization, pass top-level utilization: 'N' (string, 1–100); EstimateBuilder routes it into pricingStrategy.value.utilizationValue.",
    "workload is the INSTANCE COUNT — use it for the user's quantity. For 'two instances' set workload: 2 (one entry) or save two entries with workload: 1 each. Either is fine. Do NOT save workload: 1 for 'two instances' and stash the '2' only in description (the saved estimate prices for one instance and the user reads two). Do NOT compensate for utilization with workload (e.g. workload: 0.8 to fake 80% utilization) — the total cost may match but the saved estimate structurally lies about how many instances are running. Use the explicit utilization field instead.",
    "The dataTransferForEC2 field is a composite widget. Its value must be an array of transfer entries, each with entryType, value, unit, and a region field. Valid entryTypes: INBOUND, OUTBOUND, INTRA_REGION.",
    "Unit must be \"tb_month\" or \"gb_month\".",
    "OUTBOUND entries require a \"toRegion\" field — use \"External\" for internet or \"other\" for other AWS regions. INBOUND entries require a \"fromRegion\" field with the same options. INTRA_REGION requires neither.",
    "All three entryTypes (INBOUND, OUTBOUND, INTRA_REGION) must be present in the array even if their value is \"0\".",
    "For Dedicated Hosts (tenancy: \"host\"): instanceType must be the instance FAMILY only (e.g. \"m5\", \"c6g\"), NOT a specific size (e.g. \"m5.metal\", \"m5.xlarge\"). Do NOT set selectedOS — OS is not configured at the host level."

  ],
  "minimalConfig": {
    "region": "us-east-1",
    "description": "m5.large on-demand",
    "instanceType": "m5.large",
    "workload": 1,
    "selectedOS": "linux",
    "pricingStrategy": "ondemand"
  },
  "defaultFields": {
    "dataTransferForEC2": {
      "value": [
        { "entryType": "INBOUND", "value": "", "unit": "tb_month", "fromRegion": "External" },
        { "entryType": "OUTBOUND", "value": "", "unit": "tb_month", "toRegion": "External" },
        { "entryType": "INTRA_REGION", "value": "", "unit": "tb_month" }
      ]
    }
  }
}
