{
  "$schema": "../schema.json",
  "serviceCode": "amazonRDSForSQLServer",
  "displayName": "Amazon RDS for SQL Server",
  "templateId": "rdsForOracle",
  "status": "verified",
  "traps": [
    "The template id for RDS for SQL Server is literally 'rdsForOracle' — this is a shared/legacy template id the calculator reuses across RDS engines, NOT a mis-mapping. A saved SQL Server estimate correctly carries estimateFor: 'rdsForOracle'; the pricing engine selects the SQL Server rate card from serviceCode + the columnFormIPM mappingDefinitionName 'rds-sqlserver-calc', not from the template id.",
    "GP3 storage silently requires companion fields. When storageType is 'General Purpose-GP3' the calculator ALWAYS emits gp3Iops (baseline 3000) and gp3Throughput (baseline 125 MiBps). The manifest does NOT mark them validations.required, so get_service_fields doesn't flag them and the lint can't refuse without them — but omitting them makes the pricing engine charge for (0 - 3000) IOPS and (0 - 125) MiBps, driving the whole estimate NEGATIVE (issue #44: a db.t3.small Single-AZ Express estimate rendered -35.98 USD instead of 48.02 USD). These are injected automatically via defaultFields; keep them present. Injecting them when a non-GP3 storage type is selected is harmless — the engine ignores them.",
    "Provisioned IOPS storage has its own companions: storageType 'Provisioned IOPS' (io1) needs provisioningIOPS, and 'Provisioned IOPS-IO2' (io2) needs provisionedIOPSIO2 (both baseline 1000). If you switch storageType to io1/io2, supply the matching IOPS field or the storage line will mis-price for the same reason GP3 does.",
    "'Unbundled Licensing' is a dependent columnFormIPM cell fixed by instance class: it is TRUE for 7th-generation+ instances (m7i, r7i, r8i, x2m, ...) and FALSE for older ones, with no instance offering both (per the selector aggregations). Omitting it on a 7th-gen instance makes a directly-saved estimate silently drop the entire SQL Server/Windows licence (roughly halving the price), even though the calculator's edit view auto-selects it. The lint REFUSES to save a row that omits it when the aggregations pin it to a single value, and tells you the exact value to add (issue #48) — set e.g. {\"Unbundled Licensing\": {\"value\": \"TRUE\"}} in the row for a 7th-gen instance, FALSE for older ones.",
    "Instance configuration uses a columnFormIPM matrix — send the WRAPPED shape, NOT dotted-path keys. Shape: { columnFormIPM: { value: [{ <selectorId>: { value: '<n>' }, ... }] } }. Selector ids: 'Number of Nodes', 'Instance Type', 'Deployment Option', 'License Model', 'Database Edition', 'TermType', 'LeaseContractLength', 'PurchaseOption', 'Unbundled Licensing'. The literal string 'undefined' is the utilization slot key, and its inner value is itself an object: { value: { unit: '<percent>', selectedId: '%Utilized/Month' } }.",
    "storageType options: 'General Purpose' (gp2), 'General Purpose-GP3' (gp3), 'Provisioned IOPS' (io1), 'Provisioned IOPS-IO2' (io2), 'Magnetic'. Note the field id is 'storageType' for SQL Server (RDS for PostgreSQL uses 'storageVolume')."
  ],
  "defaultFields": {
    "gp3Iops": {
      "value": "3000"
    },
    "gp3Throughput": {
      "value": "125",
      "unit": "mbps"
    }
  },
  "minimalConfig": {
    "region": "ap-northeast-1",
    "description": "Single-AZ db.t3.small, Express, License included, gp3 storage",
    "columnFormIPM": {
      "value": [
        {
          "Number of Nodes": {
            "value": "1"
          },
          "Instance Type": {
            "value": "db.t3.small"
          },
          "undefined": {
            "value": {
              "unit": "100",
              "selectedId": "%Utilized/Month"
            }
          },
          "Deployment Option": {
            "value": "Single-AZ"
          },
          "License Model": {
            "value": "License included"
          },
          "Database Edition": {
            "value": "Express"
          },
          "TermType": {
            "value": "OnDemand"
          }
        }
      ]
    },
    "optimize": "0",
    "createRDSProxy": "0",
    "storageType": "General Purpose-GP3",
    "storageAmount": {
      "value": "20",
      "unit": "gb|NA"
    },
    "gp3Iops": "3000",
    "gp3Throughput": {
      "value": "125",
      "unit": "mbps"
    },
    "DatabaseInsightsSelected": "0"
  },
  "lastVerifiedAt": "2026-10-09",
  "verifiedEstimateId": "375fbb2ea95a5bcd2bd73b49cb8706a8f4c7bea5"
}
